{"specversion":"1.0","id":"018cc251-f400-7def-8000-000000000101","source":"/control-plane/plugin-webhooks","type":"io.cdnca.site.v1.updated","subject":"site/018cc251-f400-7def-8000-000000000201","time":"2024-01-01T00:00:00.123456Z","datacontenttype":"application/json","dataschema":"https://schemas.cdnca.example/marketplace/v1/domain-event.schema.json","tenant_id":"018cc251-f400-7def-8000-000000000030","request_id":"018cc251-f400-7def-8000-000000000301","sequence":2,"data":{"change":"updated","changed_fields":["origins"],"site_id":"018cc251-f400-7def-8000-000000000201","subject_sequence":4,"subscription_id":"018cc251-f400-7def-8000-000000000010"}}